{"id":"ji-plt-2304-portalnewsupplierinstructionssource-8bd9597d","title":"ji-plt-2304-portalnewsupplierinstructionssource-8bd9597d","format":"xml","sections":[{"path":"parametri","title":"Parametri (span)","level":1,"page":null,"paragraphs":[],"tables":[{"caption":"parametri","headers":["Parametro","Valore"],"rows":[["/span/strong","Current Suppliers:"]]}],"figures":[],"kind":"config-export"}],"meta":{"source":"CORSI/JI-2303/JI-PLT_2304_PortalNewSupplierInstructionsSource.txt","date_source":"mtime","parser":"parse-config-export","parser_version":"1","sha256":"sha256:8940679481cf8a596aeed57c9df1517579d0ef385ea05c207511ddb2ddf964d2","size":424,"exported_at":"2019-10-21","dated":"2019-10-21","kind_hint":"config-export"}}