{"id":"payment-methods-blanket-order-setup-pdf-d3622bc7","title":"Blanket Order Request Overview","format":"pdf","sections":[{"path":"p1","title":"Blanket Order Request Overview","level":1,"page":1,"paragraphs":["Blanket Order Request Overview – Pg. 1","Reference: Blanket Order Request (WebEx Recording) : https://goo.gl/tuL4Ef (Password: SUNY_blanket_01 )","1. User Request Submission Users request a Blanket Order using the “Blanket Order Request Form ” which captures the necessary information and provides instruction specific to RF and State funded Blanket Orders."],"tables":[],"figures":[{"ref":"p1-img1","page":1}]},{"path":"p2","title":"2. Blanket Order Request: Workflow","level":1,"page":2,"paragraphs":["Blanket Order Request Overview – Pg. 2","The workflow for this request ultimately ends with a Buyer to create the needed Blanket Order C ontract. This request DOES NOT result in a Purchase Order, it is merely a process to collect the needed data and obtain approvals.","Blanket Order R eview Buyer review of request to determine legitimacy and required information Funds Check Standard Funds Check: State / RF Account/Financial Approval Financial Approval: Account / Project Blanket Contract Creation Buyer queue to create internal Procurement Blanket Contract"],"tables":[],"figures":[{"ref":"p2-img1","page":2},{"ref":"p2-img2","page":2},{"ref":"p2-img3","page":2},{"ref":"p2-img4","page":2},{"ref":"p2-img5","page":2}]},{"path":"p3","title":"3. Buyer Requirements for Contract Creation:","level":1,"page":3,"paragraphs":["Blanket Order Request Overview – Pg. 3","Once the request reaches the “Blanket Contract Creation” queue of the Buyer , they need to create the Internal Procurement Blanket Order Contract . Below are the required permission (s) and TCM elements to facilitate the Contract creation.","1. Buyer(s) need to have “ Contract Manager ” permission . 1.1. Campus Decision: Add permission t o Buyer Role?","2. Campus Contract Work Group specific to “Procurement” (?) 2.1. Campus Decision: Create specific Work Group for Internal Procurement Contracts? 2.2. Temporarily added “Buyers” Role to UB Work Group “Procurement Systems Team” 2.3. A new Work Group can use a designated Number Wheel to assign Contract Numbers . i.e. UB -BLKT -###","3. Campus/Global Contract Type of “Blanket Order” (?) 3.1. Campus Decision: Create a Campus specific TCM Contract Type? 3.2. Temporarily using Global “Blanket Order” Contract Type created for Focus Group.","4. TCM Workflow Adjustments 4.1. Campus Decision: Inter nal P rocurement Contracts to skip “Signature ” workflow? 4.2. No temporary adjustments made in UIT"],"tables":[],"figures":[{"ref":"p3-img1","page":3},{"ref":"p3-img2","page":3}]},{"path":"p4","title":"5. Contract Creation Setup","level":1,"page":4,"paragraphs":["Blanket Order Request Overview – Pg. 4","Below are the Buyer steps, sections, consideration s and options for creating and editing the draft Blanket Order Contract.","5.1. Contract Header Verify info in #1 , Select a Supplier/Second Par ty in #2, Set Start/End Date (indicated in original request) in #3","Create New Contract:","• Contract Name: Free Text","• Contract Type: As defined in Step 4","• Work Group: As defined in Step 4","• Main Document Template: Optional – N/A"],"tables":[],"figures":[{"ref":"p4-img1","page":4},{"ref":"p4-img2","page":4}]},{"path":"p5","title":"Blanket Order Request Overview – Pg. 5","level":1,"page":5,"paragraphs":["Blanket Order Request Overview – Pg. 5","5.2. How will Contract be applied? By specific SKU, by Search -able Item or other means ?","5.3. Control “Releases” – Budget and Spend User spend (or “releases ”) against the Contract are enforced by setting a “Budget ” (obtained from original approved req uest) and choosing to “Enforce ” it.","If specific Product #/SKU ’s will be used to apply the Contract :","• Applies To > Product/SKU","• Manually add or import SKU ’s to be used","If Contract will be applied using defined “searcha ble ” items :","• Goods and Services > Non -Catalog Items","• Manually add or import items to be searched and placed in Cart","Other Means, Options for Applying Contract: The Con tract can be applied manually (User s election) or automatically based on ANY Purchase made for the contracted Supplier ( Second Party). See : Step 6 Post Executed: In Effect Settings","If Users Contract ed Cart items will exceed the enforced Budget amount, they will see the error below and will not be able to place their order."],"tables":[],"figures":[{"ref":"p5-img1","page":5},{"ref":"p5-img2","page":5},{"ref":"p5-img3","page":5},{"ref":"p5-img4","page":5}]},{"path":"p6","title":"Blanket Order Request Overview – Pg. 6","level":1,"page":6,"paragraphs":["Blanket Order Request Overview – Pg. 6","5.4. Control Use/Visibility Determines which User(s) have access / applicability for the Contract . Options include entire Campus, Department , Role or individual Use r(s)."],"tables":[],"figures":[{"ref":"p6-img1","page":6},{"ref":"p6-img2","page":6}]},{"path":"p7","title":"Blanket Order Request Overview – Pg. 7","level":1,"page":7,"paragraphs":["Blanket Order Request Overview – Pg. 7","5.5. Special Stipulations? – PO Clauses If needed, specific PO Clauses can be assigned which will be applied to any “Release ” Purchase Order distributed to the Supplier.","6. Post Executed: In Effect Settings These settings are only available after the Contract is Approved / Executed (non -draft) .","• “Active For Shopping ” must be “Yes ” for the Contract to be usable in ePro","• “Restrict Products To ” must be “Only for Specified Product SKUs or UNSPSC ” if Step 5.2 was used to set Product/SKU OR Non-Catalog Item applicability","• “Automatically Apply Purchases from this Suppler to this Contract ” can be used in conjunction with the Restrict Products To: Any Sup plier Product to either ; Allow the U ser to select the C ontract to apply anytime the Supplier is used OR Automatically apply the Contract anytime the Supplier is used.","See Example Setting Configurations below :"],"tables":[],"figures":[{"ref":"p7-img1","page":7},{"ref":"p7-img2","page":7}]}],"meta":{"source":"CORSI/JI-epro_3000/Class file/payment methods_blanket order_setup.pdf","image_only_pages":[],"parser":"parse-pdf","parser_version":"1","sha256":"sha256:bf02dfe503bfdab80f34750247375b90b82c92d5bd8fa990df9376c67cb3c341","size":1345927,"dated":null},"page_count":7,"scanned":false}