{"id":"quick-quote-request-form-xml-28144867","title":"Quick Quote Request Form","format":"xml","sections":[{"path":"impostazioni","title":"Impostazioni del modello di richiesta","level":1,"page":null,"paragraphs":["&lt;p&gt;&lt;span style=&quot;font-size:small;&quot;&gt;Use this form for quickly getting&amp;nbsp;a quote from multiple suppliers on specific items that are not already available on contract.&amp;nbsp; You will find separate pages in this wizard where you should complete the following:&lt;/span&gt;&lt;/p&gt; &lt;ul&gt; &lt;li&gt;&lt;span style=&quot;font-size:small;&quot;&gt;Compose a&amp;nbsp;brief message to suppliers, outlining your need and telling them to respond by emailing you their quotes.&lt;/span&gt;&lt;/li&gt; &lt;li&gt;&lt;span style=&quot;font-size:small;&quot;&gt;Answer questions&amp;nbsp;needed for the approval process.&lt;/span&gt;&lt;/li&gt; &lt;li&gt;&lt;span style=&quot;font-size:small;&quot;&gt;&lt;span style=&quot;font-size:small;&quot;&gt;Specify your product and/or service line items (note that there are separate pages for products and services; you can hide whichever is irrelevant).&lt;/span&gt;&lt;/span&gt;&lt;/li&gt; &lt;li&gt;&lt;span style=&quot;font-size:small;&quot;&gt;Select your suppliers (if using this process, please request bids from at least 3 suppliers).&lt;/span&gt;&lt;/li&gt; &lt;li&gt;&lt;span style=&quot;font-size:small;&quot;&gt;Submit the form.&lt;/span&gt;&lt;/li&gt; &lt;/ul&gt; &lt;p&gt;&lt;span style=&quot;font-size:small;&quot;&gt;If you need to see the approval process or status, click the 'Form Approvals' tab at the bottom of the form request wizard.&lt;/span&gt;&lt;/p&gt; &lt;ul&gt;&lt;/ul&gt;"],"tables":[{"caption":"impostazioni","headers":["Parametro","Valore"],"rows":[["Title","Quick Quote Request Form"],["FormType","Quick Quote"],["SearchableKeywords","quotes vendors competitive"],["purpose","QuickQuoteRequest"]]}],"figures":[],"kind":"config-export"},{"path":"domande-1","title":"Domande — Questions for Buyers / Questions for Buyers","level":1,"page":null,"paragraphs":[],"tables":[{"caption":"domande","headers":["Nome tecnico","Campo","Tipo","Obbligatorio","Gruppo","Sola lettura","Lunghezza massima","Convalide","Note"],"rows":[["285350","Please classify the type of items you are seeking in this quick quote request.","Dropdown List (Pick One)","Sì","Questions for Buyers / Questions for Buyers","","","","Please classify the type of items you are seeking in this quick quote request."],["285351","Is this item needed within the next two weeks?","Yes/No","No","Questions for Buyers / Questions for Buyers","","","","Is this item needed within the next two weeks?"],["285352","If needed quickly, briefly explain why.","Text (Multi-Line)","No","Questions for Buyers / Questions for Buyers","","","","If needed quickly, briefly explain why."],["285353","Have you searched for this item from a contract or catalog?","Yes/No","Sì","Questions for Buyers / Questions for Buyers","","","","Have you searched for this item from a contract or catalog?"],["285354","Why not? Can't you even be bothered to make the smallest effort to buy off contract? Is that too much to ask?? Explain yourself.","Text (Multi-Line)","Sì","Questions for Buyers / Questions for Buyers","","","","Why not? Can't you even be bothered to make the smallest effort to buy off contract? Is that too much to ask?? Explain yourself."]]}],"figures":[],"kind":"config-export","records":[{"kind":"question","name":"285350","label":"Please classify the type of items you are seeking in this quick quote request.","response_type":"Dropdown List (Pick One)","required":true},{"kind":"question","name":"285351","label":"Is this item needed within the next two weeks?","response_type":"Yes/No","required":false},{"kind":"question","name":"285352","label":"If needed quickly, briefly explain why.","response_type":"Text (Multi-Line)","required":false},{"kind":"question","name":"285353","label":"Have you searched for this item from a contract or catalog?","response_type":"Yes/No","required":true},{"kind":"question","name":"285354","label":"Why not? Can't you even be bothered to make the smallest effort to buy off contract? Is that too much to ask?? Explain yourself.","response_type":"Text (Multi-Line)","required":true}]}],"meta":{"source":"CORSI/JI-epro_3000/Class file/form samples/Quick Quote Request Form.xml","date_source":"mtime","parser":"parse-config-export","parser_version":"1","sha256":"sha256:015c129f41eba56b3c8ec4f38c58df18ad178025d687c0ac7abdfeb80b2a4537","size":10030,"exported_at":"2019-08-22","dated":"2019-08-22","kind_hint":"form-request-template"}}