{"id":"ji-plt-2301-requesttemplatewfdefinitions-xml-b682b99b","title":"Base Form Request Workflow","format":"xml","sections":[{"path":"impostazioni","title":"Impostazioni del workflow","level":1,"page":null,"paragraphs":[],"tables":[{"caption":"impostazioni","headers":["Parametro","Valore"],"rows":[["WorkflowType","formrequest"],["Usable","true"],["Version","1"],["VersionDescription","Base Form Request Workflow"]]}],"figures":[],"kind":"config-export"},{"path":"passi","title":"Passi (Step)","level":1,"page":null,"paragraphs":[],"tables":[{"caption":"passi","headers":["Passo","Attributi"],"rows":[["Form - Quick Quote Approval",""],["Form - Check Request Approval",""],["Form - Generic Approval",""],["Supplier Request Approval",""],["Contract Request Approval",""],["Form ADW Approval",""],["Send Quick Quote Email",""],["Create NonPO Invoice",""],["Form ADW Notification",""]]}],"figures":[],"kind":"config-export","records":[{"kind":"step","name":"Form - Quick Quote Approval","attributes":{}},{"kind":"step","name":"Form - Check Request Approval","attributes":{}},{"kind":"step","name":"Form - Generic Approval","attributes":{}},{"kind":"step","name":"Supplier Request Approval","attributes":{}},{"kind":"step","name":"Contract Request Approval","attributes":{}},{"kind":"step","name":"Form ADW Approval","attributes":{}},{"kind":"step","name":"Send Quick Quote Email","attributes":{}},{"kind":"step","name":"Create NonPO Invoice","attributes":{}},{"kind":"step","name":"Form ADW Notification","attributes":{}}]},{"path":"attivita","title":"Attività (Activity)","level":1,"page":null,"paragraphs":[],"tables":[{"caption":"attività","headers":["Attività","Tipo","Passo","Cartelle","Regola","Selezione cartella"],"rows":[["START","start","","","","Dummy"],["Form - Quick Quote Approval","manual","Form - Quick Quote Approval","Form - Quick Quote Approval","Document.IsQuickQuote == true","ExplicitFolder"],["Form - Check Request Approval","manual","Form - Check Request Approval","","Document.RequiresRuleGroupEvaluation(\"Check Request Approval\") == true","MultiElementDynamic"],["Form - Generic Approval","manual","Form - Generic Approval","","Document.RequiresRuleGroupEvaluation(\"Form Generic Approval\") == true","MultiElementDynamic"],["Supplier Request Approval","manual","Supplier Request Approval","","Document.RequiresRuleGroupEvaluation(\"Supplier Request Approval\") == true","MultiElementDynamic"],["Contract Request Approval","manual","Contract Request Approval","","Document.RequiresRuleGroupEvaluation(\"Contract Request Approval\") == true","MultiElementDynamic"],["Form ADW Approval","manual","Form ADW Approval","","Document.RequiresRuleGroupEvaluation(\"Form ADW Approval\") == true","MultiElementDynamic"],["Send Quick Quote Email","automated","Send Quick Quote Email","Quick Quote Email Robot","Document.IsQuickQuote == true","ExplicitFolder"],["Create NonPO Invoice","automated","Create NonPO Invoice","Create NonPO Invoice","Document.IsCheckRequest == true","ExplicitFolder"],["Form ADW Notification","notification","Form ADW Notification","","Document.RequiresRuleGroupEvaluation(\"Form ADW Notification\") == true","MultiElementDynamic"],["END","end","","","","Dummy"]]}],"figures":[],"kind":"config-export","records":[{"kind":"activity","name":"START","type":"start","step":null,"folders":[],"rule":null,"folder_selection_rule":"Dummy","attributes":{}},{"kind":"activity","name":"Form - Quick Quote Approval","type":"manual","step":"Form - Quick Quote Approval","folders":["Form - Quick Quote Approval"],"rule":"Document.IsQuickQuote == true","folder_selection_rule":"ExplicitFolder","attributes":{}},{"kind":"activity","name":"Form - Check Request Approval","type":"manual","step":"Form - Check Request Approval","folders":[],"rule":"Document.RequiresRuleGroupEvaluation(\"Check Request Approval\") == true","folder_selection_rule":"MultiElementDynamic","attributes":{"RuleGroupInternalName":"Check Request Approval"}},{"kind":"activity","name":"Form - Generic Approval","type":"manual","step":"Form - Generic Approval","folders":[],"rule":"Document.RequiresRuleGroupEvaluation(\"Form Generic Approval\") == true","folder_selection_rule":"MultiElementDynamic","attributes":{"RuleGroupInternalName":"Form Generic Approval"}},{"kind":"activity","name":"Supplier Request Approval","type":"manual","step":"Supplier Request Approval","folders":[],"rule":"Document.RequiresRuleGroupEvaluation(\"Supplier Request Approval\") == true","folder_selection_rule":"MultiElementDynamic","attributes":{"RuleGroupInternalName":"Supplier Request Approval"}},{"kind":"activity","name":"Contract Request Approval","type":"manual","step":"Contract Request Approval","folders":[],"rule":"Document.RequiresRuleGroupEvaluation(\"Contract Request Approval\") == true","folder_selection_rule":"MultiElementDynamic","attributes":{"RuleGroupInternalName":"Contract Request Approval"}},{"kind":"activity","name":"Form ADW Approval","type":"manual","step":"Form ADW Approval","folders":[],"rule":"Document.RequiresRuleGroupEvaluation(\"Form ADW Approval\") == true","folder_selection_rule":"MultiElementDynamic","attributes":{"RuleGroupInternalName":"Form ADW Approval"}},{"kind":"activity","name":"Send Quick Quote Email","type":"automated","step":"Send Quick Quote Email","folders":["Quick Quote Email Robot"],"rule":"Document.IsQuickQuote == true","folder_selection_rule":"ExplicitFolder","attributes":{}},{"kind":"activity","name":"Create NonPO Invoice","type":"automated","step":"Create NonPO Invoice","folders":["Create NonPO Invoice"],"rule":"Document.IsCheckRequest == true","folder_selection_rule":"ExplicitFolder","attributes":{}},{"kind":"activity","name":"Form ADW Notification","type":"notification","step":"Form ADW Notification","folders":[],"rule":"Document.RequiresRuleGroupEvaluation(\"Form ADW Notification\") == true","folder_selection_rule":"MultiElementDynamic","attributes":{"RuleGroupInternalName":"Form ADW Notification"}},{"kind":"activity","name":"END","type":"end","step":null,"folders":[],"rule":null,"folder_selection_rule":"Dummy","attributes":{}}]},{"path":"transizioni","title":"Transizioni (ActivityRelationship)","level":1,"page":null,"paragraphs":[],"tables":[{"caption":"transizioni","headers":["Da","A","Condizione"],"rows":[["START","Form - Quick Quote Approval",""],["Form - Quick Quote Approval","Form - Check Request Approval",""],["Form - Check Request Approval","Form - Generic Approval",""],["Form - Generic Approval","Supplier Request Approval",""],["Supplier Request Approval","Contract Request Approval",""],["Contract Request Approval","Form ADW Approval",""],["Form ADW Approval","Send Quick Quote Email",""],["Send Quick Quote Email","Create NonPO Invoice",""],["Create NonPO Invoice","Form ADW Notification",""],["Form ADW Notification","END",""]]}],"figures":[],"kind":"config-export","records":[{"kind":"transition","name":"START → Form - Quick Quote Approval","from":"START","to":"Form - Quick Quote Approval"},{"kind":"transition","name":"Form - Quick Quote Approval → Form - Check Request Approval","from":"Form - Quick Quote Approval","to":"Form - Check Request Approval"},{"kind":"transition","name":"Form - Check Request Approval → Form - Generic Approval","from":"Form - Check Request Approval","to":"Form - Generic Approval"},{"kind":"transition","name":"Form - Generic Approval → Supplier Request Approval","from":"Form - Generic Approval","to":"Supplier Request Approval"},{"kind":"transition","name":"Supplier Request Approval → Contract Request Approval","from":"Supplier Request Approval","to":"Contract Request Approval"},{"kind":"transition","name":"Contract Request Approval → Form ADW Approval","from":"Contract Request Approval","to":"Form ADW Approval"},{"kind":"transition","name":"Form ADW Approval → Send Quick Quote Email","from":"Form ADW Approval","to":"Send Quick Quote Email"},{"kind":"transition","name":"Send Quick Quote Email → Create NonPO Invoice","from":"Send Quick Quote Email","to":"Create NonPO Invoice"},{"kind":"transition","name":"Create NonPO Invoice → Form ADW Notification","from":"Create NonPO Invoice","to":"Form ADW Notification"},{"kind":"transition","name":"Form ADW Notification → END","from":"Form ADW Notification","to":"END"}]}],"meta":{"source":"CORSI/JI-2303/JI-PLT_2301_RequestTemplateWFDefinitions.xml","date_source":"mtime","parser":"parse-config-export","parser_version":"1","sha256":"sha256:05a5dca36ec67445abe9ddbe383af72737bd8c6c2778a4be33d92025cf550b83","size":5715,"exported_at":"2019-10-21","dated":"2019-10-21","kind_hint":"workflow-definition"}}