{"id":"ji-plt-2303-receiptwfdefinition-xml-1cd341a2","title":"Adding Document Total Amount Step","format":"xml","sections":[{"path":"impostazioni","title":"Impostazioni del workflow","level":1,"page":null,"paragraphs":[],"tables":[{"caption":"impostazioni","headers":["Parametro","Valore"],"rows":[["WorkflowType","receipt"],["Usable","true"],["Version","1"],["VersionDescription","Adding Document Total Amount Step"]]}],"figures":[],"kind":"config-export"},{"path":"passi","title":"Passi (Step)","level":1,"page":null,"paragraphs":[],"tables":[{"caption":"passi","headers":["Passo","Attributi"],"rows":[["Cost Check","wfActivityHelp: This ADW step routes receipts to a Rule Group where rules can be set up to drive them to appropriate approvers based on amount and department, account code or other factors."],["Create Inventory Receipts",""]]}],"figures":[],"kind":"config-export","records":[{"kind":"step","name":"Cost Check","attributes":{"wfActivityHelp":"This ADW step routes receipts to a Rule Group where rules can be set up to drive them to appropriate approvers based on amount and department, account code or other factors."}},{"kind":"step","name":"Create Inventory Receipts","attributes":{}}]},{"path":"attivita","title":"Attività (Activity)","level":1,"page":null,"paragraphs":[],"tables":[{"caption":"attività","headers":["Attività","Tipo","Passo","Cartelle","Regola","Selezione cartella"],"rows":[["START","start","","","","Dummy"],["CostCheck","manual","Cost Check","","Document.RequiresRuleGroupEvaluation(\"Cost Based Approvals\") == true","MultiElementDynamic"],["Create Inventory","automated","Create Inventory Receipts","Create Inventory","true","ExplicitFolder"],["END","end","","","","Dummy"]]}],"figures":[],"kind":"config-export","records":[{"kind":"activity","name":"START","type":"start","step":null,"folders":[],"rule":null,"folder_selection_rule":"Dummy","attributes":{}},{"kind":"activity","name":"CostCheck","type":"manual","step":"Cost Check","folders":[],"rule":"Document.RequiresRuleGroupEvaluation(\"Cost Based Approvals\") == true","folder_selection_rule":"MultiElementDynamic","attributes":{"RuleGroupInternalName":"Cost Based Approvals","wfActivitySupportNote":"If we have any background information for documentation purposes, we can put it within a SupportNote attribute like this. This is an ADW activity that checks a Rule Group to see whether a Receipt requires approval, and by whom. The client can create or manage rules and approvers for that Rule Group at any time, from the ADW tab.","wfActivityHelp":"This activity checks a Rule Group to see if a receipt requires approval based on cost-related factors, and if so who should approve it."}},{"kind":"activity","name":"Create Inventory","type":"automated","step":"Create Inventory Receipts","folders":["Create Inventory"],"rule":"true","folder_selection_rule":"ExplicitFolder","attributes":{"wfActivitySupportNote":"This static activity prompts an automated system action. The rule says to ALWAYS send receipts to the internal explicit folder called Create Inventory, which runs a robot called CreateInventoryRobot. (We named the folder, specified the robot and uploaded that with the accompanying Receipt WF Folders file.) This robot is built to create inventory receipts for any quantity receipt lines that have the Add to Inventory field set to true. If none are, nothing would happen but the step would still be marked complete. Note: This particular activity would ONLY be appropriate for clients who are using the Inventory Management module.","wfActivityHelp":"This ADW activity prompts the system to create inventory items."}},{"kind":"activity","name":"END","type":"end","step":null,"folders":[],"rule":null,"folder_selection_rule":"Dummy","attributes":{}}]},{"path":"transizioni","title":"Transizioni (ActivityRelationship)","level":1,"page":null,"paragraphs":[],"tables":[{"caption":"transizioni","headers":["Da","A","Condizione"],"rows":[["START","CostCheck",""],["CostCheck","Create Inventory",""],["Create Inventory","END",""]]}],"figures":[],"kind":"config-export","records":[{"kind":"transition","name":"START → CostCheck","from":"START","to":"CostCheck"},{"kind":"transition","name":"CostCheck → Create Inventory","from":"CostCheck","to":"Create Inventory"},{"kind":"transition","name":"Create Inventory → END","from":"Create Inventory","to":"END"}]}],"meta":{"source":"CORSI/JI-2303/JI-PLT_2303_ReceiptWFDefinition.xml","date_source":"mtime","parser":"parse-config-export","parser_version":"1","sha256":"sha256:dc2f65b0c5c523766f5b0b35d5445bb208888bb14921c04a0c46f1ec7a599b28","size":3598,"exported_at":"2020-04-24","dated":"2020-04-24","kind_hint":"workflow-definition"}}