{"id":"red-wagon-kit-form-xml-2be9020a","title":"red-wagon-kit-form-xml-2be9020a","format":"xml","sections":[{"path":"impostazioni","title":"Impostazioni (FormConfig)","level":1,"page":null,"paragraphs":[],"tables":[{"caption":"impostazioni","headers":["Parametro","Valore"],"rows":[["VersionDescription",""],["AdditionalInformation","This form is setup to order a wagon kit or any replacement parts."],["SearchableKeyword","red wagon kit form"],["Title","Red Wagon Kit"],["FormType","Procurement Requests"],["LimitSupplierSelection","true"]]}],"figures":[],"kind":"config-export"},{"path":"struttura","title":"Sezioni e gruppi del form","level":1,"page":null,"paragraphs":[],"tables":[{"caption":"gruppi","headers":["Gruppo","Titolo","Sezione"],"rows":[["General Info","",""],["Supplier Info","",""],["Additional Info","",""]]}],"figures":[],"kind":"config-export"},{"path":"campi-1","title":"Campi —","level":1,"page":null,"paragraphs":[],"tables":[{"caption":"campi","headers":["Nome tecnico","Campo","Tipo","Obbligatorio","Gruppo","Sola lettura","Lunghezza massima","Convalide","Note"],"rows":[["Instructions","","HTML","No","","false","","","UserDefinedFieldParamHTML=Use this form to order all the parts required to build a red wagon. This form can be used to order the entire wagon kit or specific parts. · id=10000 · tipo=userdefined"],["WagonImage","","Image","No","","false","","","UserDefinedFieldParamImageAlign=0; UserDefinedFieldParamImageUrl=/pics/orgimages/30001867/61640.jpg; UserDefinedFieldParamImageTitle=red wagon · id=10002 · tipo=userdefined"]]}],"figures":[],"kind":"config-export","records":[{"kind":"element","name":"10000","internal_name":"Instructions","title":"","group":"General Info","element_type":"userdefined","field_type":"HTML","mandatory":"No","read_only":"false","max_length":null,"validations":[]},{"kind":"element","name":"10002","internal_name":"WagonImage","title":"","group":"General Info","element_type":"userdefined","field_type":"Image","mandatory":"No","read_only":"false","max_length":null,"validations":[]}]},{"path":"campi-2","title":"Campi —","level":1,"page":null,"paragraphs":[],"tables":[{"caption":"campi","headers":["Nome tecnico","Campo","Tipo","Obbligatorio","Gruppo","Sola lettura","Lunghezza massima","Convalide","Note"],"rows":[["100","100","static","Sì","","false","","","id=100 · tipo=static"]]}],"figures":[],"kind":"config-export","records":[{"kind":"element","name":"100","internal_name":null,"title":null,"group":"Supplier Info","element_type":"static","field_type":null,"mandatory":"Sì","read_only":"false","max_length":null,"validations":[]}]},{"path":"campi-3","title":"Campi —","level":1,"page":null,"paragraphs":[],"tables":[{"caption":"campi","headers":["Nome tecnico","Campo","Tipo","Obbligatorio","Gruppo","Sola lettura","Lunghezza massima","Convalide","Note"],"rows":[["Painted Body","Wagon Main Body (Red)","FlatRateService","No","","false","","","UserDefinedFieldParam_CatalogNumber=48-0192; UserDefinedFieldParam_FeeReadOnly=true; UserDefinedFieldParam_Fee=24.95; UserDefinedFieldParam_DescriptionLabel=Wagon Body (Red); UserDefinedFieldParam_Quantity=1; UserDefinedFieldParam_ShowCatalogNumber=true · id=10005 · tipo=userdefined"],["Wheels","Wheels (4 Required)","FlatRateService","No","","false","","","UserDefinedFieldParam_CatalogNumber=43-1234; UserDefinedFieldParam_FeeReadOnly=true; UserDefinedFieldParam_Fee=4.95; UserDefinedFieldParam_DescriptionLabel=Wheels (4 Required); UserDefinedFieldParam_Quantity=4; UserDefinedFieldParam_ShowCatalogNumber=true · id=10003 · tipo=userdefined"],["RearAxelAssy","","FlatRateService","No","","false","","","UserDefinedFieldParam_CatalogNumber=48-7162; UserDefinedFieldParam_FeeReadOnly=true; UserDefinedFieldParam_Fee=12.35; UserDefinedFieldParam_DescriptionLabel=Rear Axle Assembly; UserDefinedFieldParam_Quantity=1; UserDefinedFieldParam_ShowCatalogNumber=true · id=10006 · tipo=userdefined"],["FrontAxlAssly","","FlatRateService","No","","false","","","UserDefinedFieldParam_CatalogNumber=48-7192; UserDefinedFieldParam_FeeReadOnly=true; UserDefinedFieldParam_Fee=14.95; UserDefinedFieldParam_DescriptionLabel=Front Axle Assembly; UserDefinedFieldParam_Quantity=1; UserDefinedFieldParam_ShowCatalogNumber=true · id=10007 · tipo=userdefined"],["PullHandle","","FlatRateService","No","","false","","","UserDefinedFieldParam_CatalogNumber=43-0122; UserDefinedFieldParam_FeeReadOnly=true; UserDefinedFieldParam_Fee=7.95; UserDefinedFieldParam_DescriptionLabel=Pull Handle; UserDefinedFieldParam_Quantity=1; UserDefinedFieldParam_ShowCatalogNumber=true · id=10008 · tipo=userdefined"]]}],"figures":[],"kind":"config-export","records":[{"kind":"element","name":"10005","internal_name":"Painted Body","title":"Wagon Main Body (Red)","group":"Additional Info","element_type":"userdefined","field_type":"FlatRateService","mandatory":"No","read_only":"false","max_length":null,"validations":[]},{"kind":"element","name":"10003","internal_name":"Wheels","title":"Wheels (4 Required)","group":"Additional Info","element_type":"userdefined","field_type":"FlatRateService","mandatory":"No","read_only":"false","max_length":null,"validations":[]},{"kind":"element","name":"10006","internal_name":"RearAxelAssy","title":"","group":"Additional Info","element_type":"userdefined","field_type":"FlatRateService","mandatory":"No","read_only":"false","max_length":null,"validations":[]},{"kind":"element","name":"10007","internal_name":"FrontAxlAssly","title":"","group":"Additional Info","element_type":"userdefined","field_type":"FlatRateService","mandatory":"No","read_only":"false","max_length":null,"validations":[]},{"kind":"element","name":"10008","internal_name":"PullHandle","title":"","group":"Additional Info","element_type":"userdefined","field_type":"FlatRateService","mandatory":"No","read_only":"false","max_length":null,"validations":[]}]},{"path":"campi-4","title":"Campi — senza-sezione","level":1,"page":null,"paragraphs":[],"tables":[{"caption":"campi","headers":["Nome tecnico","Campo","Tipo","Obbligatorio","Gruppo","Sola lettura","Lunghezza massima","Convalide","Note"],"rows":[["105","105","static","Sì","","false","","","id=105 · tipo=static"],["113","113","static","No","","false","","","id=113 · tipo=static"],["Unit Price","Unit Price","Price","No","","false","","","id=10001 · tipo=userdefined"]]}],"figures":[],"kind":"config-export","records":[{"kind":"element","name":"105","internal_name":null,"title":null,"group":null,"element_type":"static","field_type":null,"mandatory":"Sì","read_only":"false","max_length":null,"validations":[]},{"kind":"element","name":"113","internal_name":null,"title":null,"group":null,"element_type":"static","field_type":null,"mandatory":"No","read_only":"false","max_length":null,"validations":[]},{"kind":"element","name":"10001","internal_name":"Unit Price","title":null,"group":null,"element_type":"userdefined","field_type":"Price","mandatory":"No","read_only":"false","max_length":null,"validations":[]}]}],"meta":{"source":"CORSI/JI-epro_3000/Class file/form samples/Red Wagon Kit Form.xml","date_source":"mtime","parser":"parse-config-export","parser_version":"1","sha256":"sha256:a7cf04b721ec6adf1f4ed573b9fe83f5a5d36f8f14aa9f74e5e97d9511c914e7","size":13083,"exported_at":"2019-08-22","dated":"2019-08-22","kind_hint":"form-config"}}