{
  "id": "demo-xlsx",
  "title": "demo-xlsx",
  "format": "xlsx",
  "sections": [
    {
      "path": "sheet-1",
      "title": "Campi",
      "level": 1,
      "page": null,
      "paragraphs": [],
      "tables": [
        {
          "headers": [
            "Campo",
            "Tipo",
            "Obbligatorio",
            "Valori ammessi"
          ],
          "rows": [
            [
              "Centro di costo",
              "lookup",
              "Sì",
              null
            ],
            [
              "Categoria",
              "lista",
              "No",
              "beni;servizi"
            ],
            [
              "Stato",
              "lista",
              "lista",
              null
            ]
          ]
        }
      ],
      "figures": [],
      "validations": [
        {
          "sqref": "C2:C4",
          "type": "list",
          "values": [
            "Sì",
            "No"
          ],
          "source": null
        },
        {
          "sqref": "D2:D4",
          "type": "list",
          "values": [
            "bozza",
            "inviata"
          ],
          "source": "Liste!$A$1:$A$2"
        }
      ]
    },
    {
      "path": "sheet-2",
      "title": "Liste",
      "level": 1,
      "page": null,
      "paragraphs": [],
      "tables": [
        {
          "headers": [
            "bozza"
          ],
          "rows": [
            [
              "inviata"
            ]
          ]
        }
      ],
      "figures": [],
      "hidden": true
    },
    {
      "path": "sheet-3",
      "title": "Dati di prova",
      "level": 1,
      "page": null,
      "paragraphs": [],
      "tables": [
        {
          "headers": [
            "Test / Passo",
            "Test / Atteso",
            "Esito"
          ],
          "rows": [
            [
              "Salvare la richiesta",
              "OK",
              1
            ]
          ],
          "header_rows": 2
        }
      ],
      "figures": []
    }
  ],
  "warnings": [
    "foglio Dati di prova: intestazione su due righe, composta come \"gruppo / colonna\""
  ],
  "meta": {
    "source": "sample.xlsx",
    "parser": "parse-xlsx",
    "parser_version": "1",
    "sha256": "sha256:622a984400a9bd313bb99a1cb2a4d9ca7bea66179d001cf1c1066ad90743393d",
    "size": 1955,
    "dated": null
  }
}
